"[함께 하는 삶] 대학 시절, 선거 개표 아르바이트를 하면서 따뜻함을 실천한 적이 있습니다. 아르바이트 당시 개표 지연으로 새벽 3시가 넘어서도 일이 끝나지 않자, 대부분 학생이 수업을 핑계 삼아 집으로 돌아갔습니다. 저 또한, 오후 수업 때문에 집으로 돌아가야 했지만, 선관위 직원들이 눈에 밟혔습니다. 모든 아르바이트생이 떠난다면 남은 사람들은 몇 배 더 힘들 것이라는 생각에 끝까지 함께 하기로 했습니다. 밤새 이어진 작업에 잠이 왔지만, 그때마다 화장실로 가 찬물로 세수하면서 졸음을 쫓아가며 맡은 일을 묵묵히 했습니다. 9시가 넘어서야 모든 일이 끝났고 담당자로부터 고맙다는 말과 함께 따뜻한 국밥 한 그릇을 대접받았습니다. 남들보다 몸은 더 힘들었지만, 누군가에게 고마운 존재가 되었다는 뿌듯함에 마음만은 배불렀던 경험이었습니다. 다우기술에도 팔로우쉽을 적극적으로 실천하는 신입사원이 되겠습니다.","[미션 : 졸업 작품을 완성하라] 대학시절, 3명의 동기들과 캠퍼스 투어를 도와주는 드론을 만드는 프로젝트를 진행했습니다. 드론을 처음 접했기 때문에 제작에 많은 시행착오가 있었습니다. 처음 계획과는 다르게 드론을 제작하면서 필요한 부품이 추가로 계속 발생해, 드론 제작이 지연되어 마감기한을 한 달 남기고도 기초 비행조차 할 수 없었습니다. 팀원들은 시간 부족으로 인한 압박감을 느끼고, 반복되는 비행실패에 지쳐 의욕을 잃어가고 있었습니다. 저는 먼저 팀원들에게 할 수 있다는 동기부여와 함께, 협력을 통한 문제 해결 방법을 제시했습니다. 기존 각자 맡은 분야 외에 다른 팀원을 서포트하는 역할을 부여해 서로 협력하도록 했습니다. 주말에는 동호회를 찾아 비행을 위한 기초 설정법과 조종기 조작법을 배워 제작과 동시에 비행할 수 있는 상태를 갖췄습니다. 새로운 계획에 맞춰 차근차근 서로 맡은 분야를 도운 결과, 기한 내에 프로젝트를 완성할 수 있었습니다. 다우기술에서 IT 업무를 수행하다 보면 어려운 문제에 직면할 수 있겠지만, 도전적인 자세와 목표 설정으로 문제를 해결해나가는 지혜로운 신입사원이 되겠습니다.","[금융 서비스 융합 신입 인력 양성 교육] oooo IT 교육센터에서  2인 1조로 팀을 계좌 관리 서비스를 구축하는 프로젝트를 진행했습니다. 저는 프로그램의 구조를 설계하고 데이터의 흐름이 원활하도록 하는 서버 부분을 맡았습니다. 프로젝트를 진행하면서 중요하게 생각했던 것은 안전함과 간편함이었습니다. 돈과 관련된 프로젝트였기 때문에 무엇보다도 보안을 우선시했습니다. 고객의 개인 정보 데이터를 다룰 때는 CAESAR 암호화 기법을 통해 중요 데이터를 암호화하고 데이터 전송 시 post 방식을 사용했습니다. 또한, 간편한 서비스를 제공하기 위해 고유한 값인 휴대폰 번호를 아이디로 사용하면서, 입력받아야 하는 데이터를 최소화했습니다. 소규모 프로젝트였지만, 앞으로 프로그래머로서 어떤 부분에 중점을 두고 개발 업무를 진행해야 하는지 간접적으로 경험해 볼 기회였다고 생각합니다. 다우기술에 입사하여 Web Application 개발 업무에 참여하게 된다면, 궁극적으로 어떠한 서비스가 고객을 위한 것인지 항상 생각하는 프로그래머가 되겠습니다.","[꺼진 불도 다시 보는 습관 -> 신뢰] 제게 주어진 일은 사소한 일이라도 꼼꼼하게 확인하는 편입니다. “대충 넘어가도 괜찮지 않으냐”라는 말을 듣기도 하지만, 여러 번 확인하여 실수하지 않는 것이 상대방에 대한 배려이자, 상대방과의 신뢰라고 생각합니다. 대학본부 근로 장학생으로 일했을 때, 제 증명 발급비용을 합산해 송금하는 업무를 맡았습니다. 공금을 다루는 업무이기 때문에 실수하지 않기 위해 수입, 지출, 잔액을 세 번 이상 확인하는 습관을 들였습니다. 어느 날 발급비용 합산 중 평소와 달리 잔액이 상대적으로 적은 것을 알고 담당자에게 사실을 알리고 비용을 수정하는 조치를 했습니다. 송금 전, 지난 결산내용을 확인하고 잘못된 부분을 바로 잡아 큰 문제없이 해결할 수 있었고, 담당자로부터 신뢰할 수 있는 사람으로 인정받게 됐습니다. 이러한 저의 철두철미함은 Web Application Service 개발 업무에 있어 오류 없는 프로그램을 구현하는데 밑바탕이 될 것입니다.","['꿈' List] 저의 삶의 목표는 ‘꿈꾸는 삶’입니다. 군 시절, ‘멈추지 마, 다시 꿈부터 써봐’라는 책을 보고 아무 목표 없이 공부만 해왔던 지난날을 반성했습니다. 그리고 노트에 이루고 싶은 꿈을 하나둘씩 적기 시작했습니다. 어려운 이웃을 위해 봉사하기, 혼자 여행하기, 자전거 국토대장정 등 사소한 꿈부터 세계 일주, 서울에 집 한 채 마련하기 등 장기적인 꿈까지 다양한 꿈이 적혀있습니다. 이러한 꿈들이 제가 열정적으로 살아가는데 원동력이 되고 있습니다. 성취한 꿈을 보고 할 수 있다는 자신감을 얻고, 앞으로 이루어 나갈 꿈을 보고 목표를 상기시키는 인생의 나침반을 하고 있습니다. 또한, 언제나 꿈은 이루어진다고 생각합니다. 무모한 꿈일지라도 이루어질 것이라 믿고 꿈을 향해 한 걸음 다가간다면 ‘시작이 반’이라는 말처럼 꿈도 절반은 이루어진 것으로 생각합니다. 현재 저의 꿈은 다우기술에 입사하는 것입니다. 저는 다우기술의 인턴으로 누구보다도 열정적으로 주어진 과제를 수행해 신입사원으로 꼭 선발될 것으로 확신합니다. 다우기술에 입사해서도 꿈을 향해 멈추지 않고 도전하면서, 최고의 회사에서 최고의 삶을 만들어 가겠습니다. 저의 꿈을 실현하기 위해 기회를 주십시오.","[SNS Form과 동반 성장] 다우기술 QA 부서 인턴을 경험한 후배를 통해 다우기술이라는 회사를 알게 되었습니다. 인터넷 서비스 분야에서 다양하고 안정적인 사업모델을 가지고 있는 탄탄한 회사라고 들었습니다. B2C 보다는 B2B를 대상으로 한 사업이 많으므로 잘 알지는 못했지만, UNICRO, 결제대행 등 실제 사용해 본 서비스가 다우기술에서 제공한 서비스라는 것을 알게 되었습니다. 저는 다우기술에 입사해 SNS Form 개발 업무를 해보고 싶습니다. ‘누구나 쉽고 편리하게 이용 가능한 SNS 쇼핑 플랫폼’이라는 캐치프레이즈로 고객의 니즈를 잘 파악한 서비스라고 생각합니다. 판매자와 구매자 간의 경계가 모호해져 누구나 판매자가 될 수 있는 시대에 쉽고 빠른 소셜 플랫폼은 개인 고객에게 매력적인 서비스라고 생각합니다. A 쇼핑몰 SNS 활성화 공모전에 참여해 고객의 소리를 귀담아듣고 니즈를 끌어낸 경험과 금융서비스 융합과정에서 경험한 결제 관련 프로젝트 경험을 살려 SNS Form과 함께 성장해나가는 신입사원이 되겠습니다.",,,,
"1. 객체지향프로그래밍 A+,프로그래밍 수업을 들으면서 프로그램을 만들고 수정하는 과정이 어릴 때부터 좋아하던 수학문제를 푸는 과정과 비슷하다는 것을 깨달으면서 WEP/APP개발에 관심을 갖게 되었습니다. 2.데이터베이스 설계 A0,데이터베이스를 설계하고 빅 데이터를 분석하는데 필요한 언어와 프로그램의 사용법을 익혔습니다. 3. 컴퓨터그래픽스 설계 A0, 컴퓨터 그래픽스 설계 과목을 수강하며 OpenGL을 이용하여 3D 공간을 만들고 객체를 생성하여 컴퓨터 그래픽을 사용하는 방법을 익혔습니다.","한국oo협회가 운영하는 빅 데이터 관리자과정을 수강하여 Java, 오라클, 하둡, R 등 데이터베이스를 설계하고 빅 데이터를 분석하는데 필요한 언어와 프로그램의 사용법을 익혔습니다. 또한 단순히 수업을 듣는 데에 만족하지 않고 프로그램 하나를 배울 때마다 미니프로젝트를 진행하여 실제 사용에 필요한 경험을 얻을 수 있었고, 특허와 관련된 데이터베이스와 그 안에서 원하는 정보를 검색하는 시스템 설계하는 졸업 프로젝트를 진행 중에 있습니다.","NHN엔터테이먼트는 생활, 문화 기반의 IT서비스를 제공하는 기업이기 때문에 많은 사용자가 편리하게 이용할 수 있는 프로그램을 개발하는 것이 가장 중요하다고 생각합니다. 저는 입사 후 단순히 성과를 내기위한 개발이 아닌 고객이 필요로 하는 프로그램을 개발하려고 사용자가 만족하는 성능을 내도록 노력하겠습니다.",,,,
"고등학교를 졸업하고 대입을 다시 준비하게 되었습니다. 학원을 통해 부족한 공부를 보충하고 싶었지만 무엇보다 부모님께 경제적 부담을 드리기 싫어 여러 고민을 하게 되었습니다. 최대한 공부에 집중하면서 아르바이트 비용을 벌고자 했던 저는 많은 정보를 수집한 끝에 단과 학원에서 일하면서 수업을 무료로 들을 수 있는 제도가 있다는 것을 파악하게 되었고 면접 후 근로장학생으로 일하며 수강을 할 수 있었습니다. 지금 생각해보면 20살 재수학원의 근로 생활은 사회의 첫걸음이었습니다. 적게는 100명 많게는 300명 가까이 수강하는 수업들을 20명의 근로장학생끼리 역할을 분담하여 수업 시작 전에 강의를 위한 분필, 마이크 상태 체크 등 청소 등의 업무를 함께 하였습니다. 특히 방학 기간에는 많은 강의가 진행되었고 평상시에 학생들보다 많은 학생들이 유명한 강의를 수강하러 왔습니다. 진행되는 강의가 많다 보니 준비해야 하는 강의실이 여러 개 겹치는 상황이 발생 되기도 하였습니다. 하지만 근로장학생 서로가 본인이 맡은 일만 하는 게 아니라 시간을 내어 서로 도와주면서 인력의 부족함 해결하였고 협동이라는 것은 어려움을 함께 해결할 수 있는 강한 힘이라는 것을 깨닫게 되었습니다. 1년 가까이 단과 학원에서 근로장학생 생활을 하면서 조직화 능력, 책임감, 협동심 등을 배울 수 있는 값진 경험을 할 수 있었습니다.","개발자로서 역량을 쌓기 위해서 학기와 방학을 효율적으로 활용하여 경진대회, 해커톤 대회참가, 대외동아리 등의 다양한 활동을 하며 프로젝트를 하면서 문제해결능력과 협업능력을 길러왔습니다. 특히 학기 중에는 공부하고 싶은 기술과 만들고 싶은 서비스를 정하여 수상이라는 목표를 정하여 매년 소프트웨어 경진대회에 참여하였습니다. 매년 목표를 달성하고 경진대회에서 2015년 ,2016년 모두 수상을 하였습니다. 학교수업을 들으면서 스스로 새로운 기술을 공부하며 프로젝트를 하였기 때문에 시간상으로 부담이 있었지만, 성공 할 수 있었던 이유는 즐겼기 때문이라고 생각합니다. 사용해보고 싶었던 기술을 공부하고 그 기술을 통해 프로젝트가 하나하나 완성돼 가는 과정에서 재미를 느낄 수 있었습니다. 또한, 개발하는 도중에 알 수 없는 에러에 어려움에 부딪칠 때 에러 문을 실마리로 차근차근 인터넷 검색을 하면서 해결해가면서 스스로 문제를 해결하는 능력을 기를 수 있었습니다. 이처럼 의무적으로 하는 것이 아닌 하고 싶은 공부를 하고 그 과정에 재미를 느꼈기 때문에 시너지효과가 되어 성공할 수 있었다고 확신합니다.","""더존비즈온""에 지원한 동기는 끊음 없는 도전의 모습이 저의 가치관과 부합한다고 생각하여 지원하였습니다. 또한, 지금까지 준비해온 역량이 ""더존비즈온""에 ERP/web 개발 직무에 최적화되어있다고 확신이 들었기 때문입니다. 개발자로서 역량을 쌓기 위해 학기와 방학을 효율적으로 활용하여  대외 동아리, 경진대회 수상, 해커톤 대회 등 다양한 활동을 통해 프로젝트를 해오면서 개발자로서 중요한 협업능력, 문제해결능력을 길러왔습니다. 다양한 프로젝트를 통해 php,jsp모델2,spring framework를 통해 웹 프로젝트를 해오면  web프로젝트에 필요한 개념과 역량을 쌓아왔습니다. 현재는 spring framework을 통해 대학교에서 사용하는 후원인 시스템을 개발하면서 실전감각을 익히고 있으며 대학발전실에 업무를 위한 기능까지 개발하는 후원인 관리 프로그램의 경험은 ERP개발의 축소판이라고 생각합니다. 그러므로 기획과 개발을 하면서 경험한 프로세스와 개발 로직은 ""더존비즈온""에서 ERP/WEB개발부서에 빠르게 적응하고 맡은 업무를 충실히 수행하여 이바지 할수 있다고 확신합니다.","대학생활 동안에 연합 개발 동아리, 경진대회, 해커톤 대회 등을 참여하여 프로젝트를 하면서 동기들과 프로젝트를 하기도 하였고 처음 보는 사람들과 바로 호흡을 맞추어 2박 3일간에 결과물을 완성하는 등 다양한 활동을 통해 협업능력과 문제해결능력을 길러왔습니다. 연합 동아리를 통해 직장인, 디자이너와 함께 프로젝트를 하면서 팀원들 간에 회의를 통해 아이디어에 대해 의논을 하기도 하고 디자이너와 회의를 하면서 개발자들에게 약한 사용자 입장에서의 UI/UX를 배울 수 있었습니다. 또한, 실무에서 개발을 하는 직장인과 함께 개발하면서 RSS파싱, 효율적인 코드의 법칙 등 학생끼리는 알기 힘든 부분을  배울 수 있었습니다. 현재는 이처럼 다양한 경험을 통해 쌓은 역량을 밑거름으로 삼아 ""후원회 관리 시스템""을 외주 받아 개발완성과 동시에 바로 사용하는 시스템을 개발하고 있습니다. 한 달간 직원분과 회의를 통해 요구사항에 관해 이야기를 하면서 서로 간에 입장에서 조율하고 문서화를 하여 시스템의 클라이언트 부분과 데이터베이스를 설계하였습니다. 데이터베이스 설계가 완성된 이후에는 팀원들과 역할을 나누어 개발을 마무리하고 있습니다. 이처럼 다양한 경험을 통해 쌓은 협업능력과 실전을 통해 점점 성장해가고 있는 역량은 반드시 web 개발부서에서 빠르게 적응하여 본인의 역할을 충실히 이행하며 ""더존비즈온"" 전체와 서비스에 개선에 이바지할 수 있다고 확신합니다.",,,
"1) OO 모바일 앱 서비스 개발 - 기관명 : (주)OO - 기간 : 2015.01 ~ 2015.09 - 근무부서/직위 : 서비스 개발/개발 전담 - 서비스 소개 : 남성 퍼스널 스타일링 서브스크립션 O2O 서비스 - 업무 성과 : 서비스 개발 완료 및 구글 플레이 스토어 상용화, 전체 회원가입자수 5000명 달성, 정기 스타일링 서비스 신청회원 200명 달성 - 개발환경 : [Java(Android), Node.js / Eclipse], [MySQL / MySQL WorkBench], [SVN / Subclipse] - 담당개발 : Client 전체 개발, 미들웨어 서버 개발, DB 설계 및 구축 ● Client Side 안드로이드 개발 : UX 설계에 따른 Layout 구현 및 서버와 통신을 위한 Network Manager 모듈 개발 ● Server Side 미들웨어 서버 개발 : Node.js를 이용한 Restful API 서비스 개발. Amazon AWS EC2를 이용한 Server Hosting 구축, 결재 PG사와 서버 연동, 배송 현황 및 도로명/지번 주소 검색 Open API를 이용한 배송조회 및 주소입력 기능 구현 ● DB MySQL : 회원정보의 트렌젝션-세이프를 위해 InnoDB의 MySQL을 통해 DB 구축. Amazon AWS RDS를 이용한 DB Server Hosting 구축 2) Smartfren MIFI Andromax M2Y Firmware 개발 - 기관명 : (주)OO - 기간 : 2016.01 ~ 2016.04 - 근무부서/직위 : Firmware Application 개발/인턴 - 프로젝트 소개 : 인도네시아 통신사 중 하나인 Smartfren사의 포켓WiFi인 ‘Andromax M2Y’의 Firmware를 개발하였습니다. 해당 Device는 4G LTE 신호를 포켓WiFi를 이용하여 데이터를 사용할 수 있도록 해주는 휴대용 라우터입니다. - 업무성과 : 프로젝트 개발완료 및 고객사측 Solution 배포 완료, 당사 상반기 매출 15% 수준 달성에 기여 - 개발환경 : [Linux / Ubuntu 14.01], [C, Shell, javascript / Eclipse CDT], [SVN / GCT SVN SourceStorage] - 담당개발 : Marvell WiFi Application 제어 Daemon 개발, 네트워크 고급설정 기능 구현, WiFi Disk 구현 ● Marvell WiFi Application 제어 Daemon 개발 CPE Web Page : Host IP를 통해 사용자가 WiFi 설정 정보를 변경 할 수 있도록 Web UI 구현 WiFi 모듈 제어 Daemon : Marvell WiFi 모뎀칩상의 WiFi Application을 통해 WiFi 구성 정보를 설정하고 제어하는 Daemon 프로그램 개발 ● 네트워크 고급설정 기능 구현 외부 네트워크 Filtering 기능 구현: MAC/IP/PORT/URL Filter 및 Port Forwarding ● WiFi Disk 웹스토리지 기능. 해당 Device에 탑재된 MicroSD Card로 WiFi 신호를 통해 File 송수신. 기능으로는 File Upload, Download, Delete, Renaming, New Folder와 Image/Text/Audio/Movie File을 Web Page 상으로 미리 보는 미리 보기 기능 구현 3) INC Smart Meter - 기관명 : (주)OO - 기간 : 2016.05 ~ 2016.06 - 근무부서/직위 : Firmware Application 개발/인턴 - 프로젝트 소개 :  각 가정의 전기 사용량을 측정한 데이터를 LTE 신호에 실어 전기 회사에 송수신하는 스마트 계량기의 Firmware Solution을 개발하였습니다. - 업무 성과 : 프로젝트 개발 완료 및 Solution 배포 - 개발환경 : 개발환경 : [Linux / Ubuntu 14.01], [C, Shell / Eclipse CDT], [SVN / GCT SVN SourceStorage] - 담당개발 : Multi Client Socket Server 구현 ● Multi Client Sokcet Server 구현 동시에 10개의 Client Application과 동시에 통신하는 비동기식 TCP Socket Server 구현 [PR] 프로그래머로서 꼭 필요한 프로젝트에 대한 진행과정의 이해, 커뮤니케이션 능력 뿐만 아니라 다른 분야의 사람들과 함께 일을 해결해 나갈 수 있는 능력이 우수하다고 생각합니다. 개발자가 가져야 할 기술력, 책임감, 인내력 등의 요소에서 어느 누구에게도 뒤떨어지지 않을 자신이 있습니다. 저의 자질을 최대한 발휘하여 NICE정보통신의 기대에 꼭 부응하겠습니다.","어렸을 적부터 남들이 상상도 하지 못한 미래의 해저도시, 음식, 패션 등을 그려 주변사람들을 놀라게 함으로써 독특한 아이디어를 가졌다는 평을 받았습니다. 이러한 저의 독특한 아이디어를 자유롭게 실현할 수 있는 프로그래밍에 흥미를 느끼게 되었고 자연스레 컴퓨터공학과로 진학하게 되었습니다. 남들이 생각해내지 못한 새로운 개념의 서비스를 개발하고자 대학 전공뿐만 아니라 개발 전문가 교육기관인 oo아카데미에서 다수의 프로그래밍 전문가 과정을 이수함으로써 개발자로서의 역량을 쌓고자 노력하였습니다. 독특한 아이디어로 세상을 놀라게 하기 위한 첫 걸음으로 1년 전, ‘OO’이라는 패션 쇼핑몰을 창업하였습니다. ‘선결제 후확인’이라는 기존 쇼핑몰과 차별을 둔 ‘선확인 후결제’라는 운영방식을 통해 고객의 신뢰와 편의성을 제공하고자 하였습니다. 또한 개인맞춤 스타일링 서비스 제공이라는 콘셉트를 통해 기존 쇼핑몰과 경쟁력을 갖추고자 하였고 여성이 아닌 남성을 주 고객층으로 함으로써 틈새시장을 공략하였습니다. 이는 자연스레 쇼핑몰 업계 최초로 남성 개별맞춤 O2O 스타일링 서비스를 실현한 계기가 되었고, 경쟁사 대비 반품 및 환불이 평균 4% 낮은 비율로 발생하게 되었습니다. 이러한 결과를 바탕으로 SK 플래닛의 육성 스타트업으로 선정되는 기회를 얻을 수 있었습니다. 하지만 이런 성과에도 무슨 문제든 혼자서 해결하려 하는 단점 때문에 서비스 개발 도중 뜻하지 않게 어려움에 부딪힌 적이 있습니다. 결제 시스템 구현 도중 결제PG사에서 제공하는 PHP 기반의 코드 샘플 및 매뉴얼이 제가 구현한 서버 플랫폼인 Node.js와 많이 달라 구현에 어려움을 겪었습니다. PHP 프로그래밍 서적과 인터넷 검색 등 노력을 하였지만 5일이라는 시간을 허비하게 되었습니다. 결국 결제PG사에 전화 및 메일을 통해 실무자에게 도움을 요청하였고 단 하루 만에 간단하게 해결할 수 있는 문제였음을 알게 되었을 때 큰 허탈감을 느꼈습니다. 이를 계기로 문제가 발생하면 대상이 누구든 먼저 다가가 물어보고 배움으로써 빠르게 문제를 해결하고자 노력하고 있습니다. 비록 단점 때문에 서비스 개발 도중 어려운 일도 많았지만 ‘서비스의 주인은 나’라는 책임감이 쇼핑몰 서비스를 상용화하도록 이끈 원동력이었습니다. 다양한 전공으로 구성된 창업 팀에서 개발자는 저 혼자뿐이었기 때문에 서비스의 프론트/백-엔드 를 혼자서 개발하는 것은 쉬운 일이 아니었습니다. 하지만 이 창업은 내 아이디어로 시작되었고 나 이외의 누구도 개발을 맡을 수 없다는 책임감을 가지고 3개월간 사무실에서 밤낮을 새운 끝에 목표한 기간 내에 서비스를 구현하고 상용화 할 수 있었습니다. 패션 쇼핑몰 창업을 통해 기존의 쇼핑몰에서는 찾아볼 수 없었던 최초의 남성 퍼스널 스타일링 서비스를 창조함으로써 ‘열정’과 ‘도전’을 실천하였고 탄탄한 서비스를 개발하기 위해 학교를 뛰쳐나와 개발 전문가 교육기관에 직접 입학하여 전문 역량을 쌓고자 한 ‘프로정신’이 NICE의 인재상과 잘 부합한다고 판단하여 지원하게 되었습니다.",,,
